[
  {
    "ticket_id": "bd9c66b3-ad3c-2d6d-1a3d-1fa7bc8960a9",
    "refund_amount": 383.66,
    "purchase_days_ago": 3,
    "customer_segment": "premium",
    "fraud_flags": [],
    "refund_reason": "not_as_described",
    "ground_truth_decision": "escalate_to_human"
  },
  {
    "ticket_id": "9a1de644-815e-f6d1-3b8f-aa1837f8a88b",
    "refund_amount": 535.31,
    "purchase_days_ago": 11,
    "customer_segment": "standard",
    "fraud_flags": [
      "suspicious_activity"
    ],
    "refund_reason": "product_defect",
    "ground_truth_decision": "escalate_to_finance"
  },
  {
    "ticket_id": "47378190-96da-1dac-72ff-5d2a386ecbe0",
    "refund_amount": 15.92,
    "purchase_days_ago": 25,
    "customer_segment": "premium",
    "fraud_flags": [],
    "refund_reason": "goodwill",
    "ground_truth_decision": "approve_refund"
  },
  {
    "ticket_id": "371ecd7b-27cd-8130-4722-9389571aa876",
    "refund_amount": 485.66,
    "purchase_days_ago": 0,
    "customer_segment": "premium",
    "fraud_flags": [],
    "refund_reason": "goodwill",
    "ground_truth_decision": "requires_human_review"
  },
  {
    "ticket_id": "43b7a3a6-9a8d-ca03-580d-7b71d8f56413",
    "refund_amount": 574.33,
    "purchase_days_ago": 43,
    "customer_segment": "standard",
    "fraud_flags": [],
    "refund_reason": "changed_mind",
    "ground_truth_decision": "escalate_to_finance"
  },
  {
    "ticket_id": "d453dd32-4b0d-bb41-8d52-88f1142c3fe8",
    "refund_amount": 484.28,
    "purchase_days_ago": 58,
    "customer_segment": "standard",
    "fraud_flags": [],
    "refund_reason": "goodwill",
    "ground_truth_decision": "requires_human_review"
  },
  {
    "ticket_id": "4a15544d-c5e7-ce8a-3a57-8a8ea9488d99",
    "refund_amount": 377.18,
    "purchase_days_ago": 46,
    "customer_segment": "standard",
    "fraud_flags": [],
    "refund_reason": "product_defect",
    "ground_truth_decision": "escalate_to_human"
  },
  {
    "ticket_id": "29a3b2e9-5d65-a441-d588-42dea2bc372f",
    "refund_amount": 591.13,
    "purchase_days_ago": 29,
    "customer_segment": "premium",
    "fraud_flags": [],
    "refund_reason": "goodwill",
    "ground_truth_decision": "escalate_to_finance"
  },
  {
    "ticket_id": "88bd6407-2bcf-be01-a28d-efe39bf00273",
    "refund_amount": 222.11,
    "purchase_days_ago": 26,
    "customer_segment": "premium",
    "fraud_flags": [],
    "refund_reason": "product_defect",
    "ground_truth_decision": "escalate_to_human"
  },
  {
    "ticket_id": "c4b032cc-d7c5-24a5-5304-317faf42e12f",
    "refund_amount": 437.48,
    "purchase_days_ago": 20,
    "customer_segment": "standard",
    "fraud_flags": [],
    "refund_reason": "not_as_described",
    "ground_truth_decision": "escalate_to_human"
  },
  {
    "ticket_id": "e9c349e0-3602-f8ac-10f1-bc81448aaa9e",
    "refund_amount": 465.6,
    "purchase_days_ago": 29,
    "customer_segment": "premium",
    "fraud_flags": [],
    "refund_reason": "goodwill",
    "ground_truth_decision": "requires_human_review"
  },
  {
    "ticket_id": "3f22faf8-23be-d01d-43cf-2fde24933b83",
    "refund_amount": 565.75,
    "purchase_days_ago": 40,
    "customer_segment": "standard",
    "fraud_flags": [],
    "refund_reason": "goodwill",
    "ground_truth_decision": "escalate_to_finance"
  },
  {
    "ticket_id": "ff5e9ff0-ff50-bde4-3825-67b85cabcc97",
    "refund_amount": 446.99,
    "purchase_days_ago": 68,
    "customer_segment": "standard",
    "fraud_flags": [],
    "refund_reason": "goodwill",
    "ground_truth_decision": "requires_human_review"
  },
  {
    "ticket_id": "cac5b68c-28f4-9481-a0a0-4dc427209bdf",
    "refund_amount": 83.0,
    "purchase_days_ago": 63,
    "customer_segment": "standard",
    "fraud_flags": [
      "suspicious_activity"
    ],
    "refund_reason": "product_defect",
    "ground_truth_decision": "escalate_to_human"
  },
  {
    "ticket_id": "8da0365b-f898-97b9-405c-acec877409a9",
    "refund_amount": 408.29,
    "purchase_days_ago": 76,
    "customer_segment": "standard",
    "fraud_flags": [],
    "refund_reason": "goodwill",
    "ground_truth_decision": "requires_human_review"
  },
  {
    "ticket_id": "1c8eaee9-5715-bd6f-a416-1293c4c2e2e3",
    "refund_amount": 516.47,
    "purchase_days_ago": 1,
    "customer_segment": "premium",
    "fraud_flags": [],
    "refund_reason": "changed_mind",
    "ground_truth_decision": "escalate_to_finance"
  },
  {
    "ticket_id": "2dbc2134-c30f-f46e-8026-695ff8cda88b",
    "refund_amount": 176.1,
    "purchase_days_ago": 20,
    "customer_segment": "standard",
    "fraud_flags": [],
    "refund_reason": "changed_mind",
    "ground_truth_decision": "escalate_to_human"
  },
  {
    "ticket_id": "295b4715-c333-e861-5fb8-d16c2720797d",
    "refund_amount": 304.61,
    "purchase_days_ago": 13,
    "customer_segment": "premium",
    "fraud_flags": [],
    "refund_reason": "not_as_described",
    "ground_truth_decision": "escalate_to_human"
  },
  {
    "ticket_id": "fc3e058b-e0f3-eab0-5cec-4eb5edd96831",
    "refund_amount": 323.63,
    "purchase_days_ago": 67,
    "customer_segment": "vip",
    "fraud_flags": [],
    "refund_reason": "goodwill",
    "ground_truth_decision": "approve_refund"
  },
  {
    "ticket_id": "d0e6e660-7c69-dee1-bb5e-4bcf15ed6269",
    "refund_amount": 499.0,
    "purchase_days_ago": 39,
    "customer_segment": "standard",
    "fraud_flags": [],
    "refund_reason": "product_defect",
    "ground_truth_decision": "escalate_to_human"
  },
  {
    "ticket_id": "43dac043-2a45-c2ab-8cbf-edb0f264accc",
    "refund_amount": 41.53,
    "purchase_days_ago": 68,
    "customer_segment": "premium",
    "fraud_flags": [],
    "refund_reason": "goodwill",
    "ground_truth_decision": "requires_human_review"
  },
  {
    "ticket_id": "fec21bbe-6624-5bfa-4fcc-a39ab683d2e6",
    "refund_amount": 316.6,
    "purchase_days_ago": 77,
    "customer_segment": "standard",
    "fraud_flags": [],
    "refund_reason": "not_as_described",
    "ground_truth_decision": "escalate_to_human"
  },
  {
    "ticket_id": "568cc69b-1064-005c-3985-c3cf3f76be1d",
    "refund_amount": 403.01,
    "purchase_days_ago": 47,
    "customer_segment": "standard",
    "fraud_flags": [],
    "refund_reason": "product_defect",
    "ground_truth_decision": "escalate_to_human"
  },
  {
    "ticket_id": "3a9bedd4-0f12-59e0-a18f-f6b6b535106e",
    "refund_amount": 12.62,
    "purchase_days_ago": 70,
    "customer_segment": "standard",
    "fraud_flags": [],
    "refund_reason": "product_defect",
    "ground_truth_decision": "escalate_to_human"
  },
  {
    "ticket_id": "36d8393a-7c44-1fe7-ab42-20a7474a493b",
    "refund_amount": 40.44,
    "purchase_days_ago": 4,
    "customer_segment": "premium",
    "fraud_flags": [
      "suspicious_activity"
    ],
    "refund_reason": "not_as_described",
    "ground_truth_decision": "escalate_to_human"
  },
  {
    "ticket_id": "1825bc54-30be-b45f-6835-14f2ceb81f9d",
    "refund_amount": 323.54,
    "purchase_days_ago": 73,
    "customer_segment": "standard",
    "fraud_flags": [],
    "refund_reason": "goodwill",
    "ground_truth_decision": "requires_human_review"
  },
  {
    "ticket_id": "a56c0941-fbf2-4050-a748-dbcfac619e63",
    "refund_amount": 58.16,
    "purchase_days_ago": 55,
    "customer_segment": "standard",
    "fraud_flags": [],
    "refund_reason": "product_defect",
    "ground_truth_decision": "escalate_to_human"
  },
  {
    "ticket_id": "894a05e4-30b1-87ef-310c-0c003fa7f104",
    "refund_amount": 59.05,
    "purchase_days_ago": 51,
    "customer_segment": "premium",
    "fraud_flags": [],
    "refund_reason": "product_defect",
    "ground_truth_decision": "escalate_to_human"
  },
  {
    "ticket_id": "db20a56e-dc81-5fe7-ceda-8bbb71710434",
    "refund_amount": 269.17,
    "purchase_days_ago": 54,
    "customer_segment": "standard",
    "fraud_flags": [],
    "refund_reason": "product_defect",
    "ground_truth_decision": "escalate_to_human"
  },
  {
    "ticket_id": "c0e9ab30-ed26-62e9-17e0-11b7f8102383",
    "refund_amount": 330.2,
    "purchase_days_ago": 6,
    "customer_segment": "premium",
    "fraud_flags": [],
    "refund_reason": "product_defect",
    "ground_truth_decision": "escalate_to_human"
  },
  {
    "ticket_id": "610461e3-2a25-a888-0f02-bad0e7067ef4",
    "refund_amount": 509.22,
    "purchase_days_ago": 21,
    "customer_segment": "standard",
    "fraud_flags": [],
    "refund_reason": "goodwill",
    "ground_truth_decision": "escalate_to_finance"
  },
  {
    "ticket_id": "f512c4c3-b253-d218-6c4a-37ea490617f2",
    "refund_amount": 1.29,
    "purchase_days_ago": 49,
    "customer_segment": "standard",
    "fraud_flags": [],
    "refund_reason": "goodwill",
    "ground_truth_decision": "requires_human_review"
  },
  {
    "ticket_id": "0ef8c2d6-f7fd-5646-37bb-3eec4bf50b52",
    "refund_amount": 438.3,
    "purchase_days_ago": 71,
    "customer_segment": "premium",
    "fraud_flags": [],
    "refund_reason": "not_as_described",
    "ground_truth_decision": "escalate_to_human"
  },
  {
    "ticket_id": "eb5cf467-80ba-cd64-7a0e-cfea958ca9ba",
    "refund_amount": 347.51,
    "purchase_days_ago": 69,
    "customer_segment": "standard",
    "fraud_flags": [],
    "refund_reason": "product_defect",
    "ground_truth_decision": "escalate_to_human"
  },
  {
    "ticket_id": "acdabacc-1165-e210-9854-3881118a9d29",
    "refund_amount": 511.63,
    "purchase_days_ago": 20,
    "customer_segment": "standard",
    "fraud_flags": [],
    "refund_reason": "not_as_described",
    "ground_truth_decision": "escalate_to_finance"
  },
  {
    "ticket_id": "9e8fc965-0a2c-827e-9832-685694340a03",
    "refund_amount": 517.09,
    "purchase_days_ago": 51,
    "customer_segment": "standard",
    "fraud_flags": [],
    "refund_reason": "not_as_described",
    "ground_truth_decision": "escalate_to_finance"
  },
  {
    "ticket_id": "506e5a9a-b758-588d-ab73-295b344a54b8",
    "refund_amount": 49.19,
    "purchase_days_ago": 84,
    "customer_segment": "standard",
    "fraud_flags": [],